{
  "region": {
    "code": "CH-TI",
    "country": "CH",
    "name": "Tessin",
    "system": "patent"
  },
  "validFrom": "2026-07-03",
  "source": {
    "title": "Repubblica e Cantone Ticino – Regolamento sulla caccia e la protezione dei mammiferi e degli uccelli selvatici dell'11 luglio 2006 (RL 922.110), artt. 25, 39, 42 – stato 3 luglio 2026 (stagione 2026)",
    "url": "https://m3.ti.ch/CAN/RLeggi/public/index.php/raccolta-leggi/legge/num/494",
    "retrieved": "2026-10-02"
  },
  "confidence": "high",
  "remarks": "Patentjagd. Daten werden jährlich im Regolamento angepasst (Stagione 2026). Caccia alta 05.–19.09 und 23.–27.09.2026; caccia bassa 16.10–30.11.2026 (Di, Mi, Do, Sa, So); caccia acquatica 15.12.2026–31.01.2027. Jagdbar nur Arten nach art. 25. Zahlreiche Kontingente/Geschlechts-/Altersregeln (art. 42). Caccia tardo autunnale (Hirsch/Reh) und caccia speciale al cinghiale/alla volpe nur auf Anordnung des UCP (artt. 26–28). Steinbock nur selektive Regulierung (RL 922.120).",
  "species": [
    {
      "name": "Rothirsch",
      "category": "",
      "scientificName": "Cervus elaphus",
      "openSeason": [
        {
          "from": "09-05",
          "to": "09-19"
        },
        {
          "from": "09-23",
          "to": "09-27"
        }
      ],
      "protectedAllYear": false,
      "note": "Caccia alta; caccia tardo autunnale nach UCP-Anordnung möglich (art. 26)",
      "id": "rothirsch"
    },
    {
      "name": "Reh",
      "category": "",
      "scientificName": "Capreolus capreolus",
      "openSeason": [
        {
          "from": "09-05",
          "to": "09-17"
        }
      ],
      "protectedAllYear": false,
      "note": "Caccia alta: capriolo nur 5.–17.09, Kontingent nach Abschussplan (art. 42); regionale Sperrung Leventina/Blenio 2025-27 lt. Vorerhebung – unbestätigt",
      "id": "reh"
    },
    {
      "name": "Gämse",
      "category": "",
      "scientificName": "Rupicapra rupicapra",
      "openSeason": [
        {
          "from": "09-05",
          "to": "09-17"
        }
      ],
      "protectedAllYear": false,
      "note": "Caccia alta: camoscio 5.–17.09 (Bock ≥2.5 J. u. a. am 8.09), max. 3 Stück (art. 42)",
      "id": "gaemse"
    },
    {
      "name": "Wildschwein",
      "category": "",
      "scientificName": "Sus scrofa",
      "openSeason": [
        {
          "from": "09-05",
          "to": "09-19"
        },
        {
          "from": "09-23",
          "to": "09-27"
        }
      ],
      "protectedAllYear": false,
      "note": "wahrscheinlich – nur caccia alta (cinghiale nicht in Artenliste caccia bassa, art. 25); caccia speciale/invernale nur nach UCP-Anordnung (art. 27)",
      "id": "wildschwein"
    },
    {
      "name": "Murmeltier",
      "category": "",
      "scientificName": "Marmota marmota",
      "openSeason": [
        {
          "from": "09-09",
          "to": "09-11"
        }
      ],
      "protectedAllYear": false,
      "note": "2 Stück pro Jäger, nur 9.–11.09 (art. 42)",
      "id": "murmeltier"
    },
    {
      "name": "Feldhase",
      "category": "",
      "scientificName": "Lepus europaeus",
      "openSeason": [
        {
          "from": "10-16",
          "to": "11-01"
        }
      ],
      "protectedAllYear": false,
      "note": "lepre comune nur am 16., 18., 25.10. und 1.11.2026, 1 Stück (art. 42)",
      "id": "feldhase"
    },
    {
      "name": "Schneehase",
      "category": "",
      "scientificName": "Lepus timidus",
      "openSeason": [
        {
          "from": "10-16",
          "to": "11-30"
        }
      ],
      "protectedAllYear": false,
      "note": "lepre variabile nur an festgelegten Tagen (16., 18., 25.10.; 1., 7., 8., 15., 22., 29., 30.11.), 1 Stück (art. 42)",
      "id": "schneehase"
    },
    {
      "name": "Fuchs",
      "category": "",
      "scientificName": "Vulpes vulpes",
      "openSeason": [
        {
          "from": "09-05",
          "to": "09-27"
        },
        {
          "from": "10-16",
          "to": "11-30"
        }
      ],
      "protectedAllYear": false,
      "note": "caccia alta + bassa",
      "id": "fuchs"
    },
    {
      "name": "Dachs",
      "category": "",
      "scientificName": "Meles meles",
      "openSeason": [
        {
          "from": "09-05",
          "to": "09-27"
        },
        {
          "from": "10-16",
          "to": "11-30"
        }
      ],
      "protectedAllYear": false,
      "note": "caccia alta + bassa (tasso)",
      "id": "dachs"
    },
    {
      "name": "Steinmarder",
      "category": "",
      "scientificName": "Martes foina",
      "openSeason": [
        {
          "from": "10-16",
          "to": "11-30"
        }
      ],
      "protectedAllYear": false,
      "note": "faina, caccia bassa (art. 25)",
      "id": "steinmarder"
    },
    {
      "name": "Birkhahn",
      "category": "",
      "scientificName": "Lyrurus tetrix",
      "openSeason": [
        {
          "from": "10-16",
          "to": "11-30"
        }
      ],
      "protectedAllYear": false,
      "note": "fagiano di monte: nur Hahn, festgelegte Tage 16.10–30.11, 1 Stück (art. 42)",
      "id": "birkhahn"
    },
    {
      "name": "Schneehuhn",
      "category": "",
      "scientificName": "Lagopus muta",
      "openSeason": [],
      "protectedAllYear": true,
      "note": "pernice bianca in TI nicht jagdbar (nicht in Artenliste art. 25 RL 922.110)",
      "id": "schneehuhn"
    },
    {
      "name": "Steinhuhn",
      "category": "",
      "scientificName": "Alectoris graeca",
      "openSeason": [],
      "protectedAllYear": true,
      "note": "bundesrechtlich geschützt (nicht in JSG Art. 5 Abs. 1); auch nicht in Artenliste art. 25 RL 922.110",
      "id": "steinhuhn"
    },
    {
      "name": "Stockente",
      "category": "",
      "scientificName": "Anas platyrhynchos",
      "openSeason": [
        {
          "from": "10-16",
          "to": "11-30"
        },
        {
          "from": "12-15",
          "to": "01-31"
        }
      ],
      "protectedAllYear": false,
      "note": "germano reale: caccia bassa + caccia acquatica (artt. 25, 39)",
      "id": "stockente"
    },
    {
      "name": "Blässhuhn",
      "category": "",
      "scientificName": "Fulica atra",
      "openSeason": [
        {
          "from": "12-15",
          "to": "01-31"
        }
      ],
      "protectedAllYear": false,
      "note": "folaga nur caccia acquatica (art. 25 lit. c, art. 39 lit. c)",
      "id": "blaesshuhn"
    },
    {
      "name": "Waldschnepfe",
      "category": "",
      "scientificName": "Scolopax rusticola",
      "openSeason": [
        {
          "from": "10-16",
          "to": "11-30"
        }
      ],
      "protectedAllYear": false,
      "note": "beccaccia, caccia bassa; max. 15 (art. 42)",
      "id": "waldschnepfe"
    },
    {
      "name": "Ringeltaube",
      "category": "",
      "scientificName": "Columba palumbus",
      "openSeason": [
        {
          "from": "10-16",
          "to": "11-30"
        }
      ],
      "protectedAllYear": false,
      "note": "colombaccio, caccia bassa (art. 25)",
      "id": "ringeltaube"
    },
    {
      "name": "Türkentaube",
      "category": "",
      "scientificName": "Streptopelia decaocto",
      "openSeason": [
        {
          "from": "10-16",
          "to": "11-30"
        }
      ],
      "protectedAllYear": false,
      "note": "tortora dal collare, caccia bassa (art. 25)",
      "id": "tuerkentaube"
    },
    {
      "name": "Rabenkrähe",
      "category": "",
      "scientificName": "Corvus corone",
      "openSeason": [
        {
          "from": "10-16",
          "to": "11-30"
        }
      ],
      "protectedAllYear": false,
      "note": "cornacchia nera/grigia, caccia bassa (art. 25)",
      "id": "rabenkraehe"
    },
    {
      "name": "Elster",
      "category": "",
      "scientificName": "Pica pica",
      "openSeason": [],
      "protectedAllYear": true,
      "note": "wahrscheinlich – gazza nicht in Artenliste art. 25 RL 922.110 → in TI nicht jagdbar",
      "id": "elster"
    },
    {
      "name": "Eichelhäher",
      "category": "",
      "scientificName": "Garrulus glandarius",
      "openSeason": [
        {
          "from": "10-16",
          "to": "11-30"
        }
      ],
      "protectedAllYear": false,
      "note": "ghiandaia, caccia bassa (art. 25)",
      "id": "eichelhaeher"
    },
    {
      "name": "Iltis",
      "category": "",
      "scientificName": "Mustela putorius",
      "openSeason": [],
      "protectedAllYear": true,
      "note": "nicht jagdbar – geschützt",
      "id": "iltis"
    },
    {
      "name": "Hermelin",
      "category": "",
      "scientificName": "Mustela erminea",
      "openSeason": [],
      "protectedAllYear": true,
      "note": "nicht jagdbar – geschützt",
      "id": "hermelin"
    }
  ]
}
