{
  "region": {
    "code": "CH-AG",
    "country": "CH",
    "name": "Aargau",
    "system": "revier"
  },
  "validFrom": "2025-08-30",
  "source": {
    "title": "Kanton Aargau – Verordnung zum Jagdgesetz (AJSV) SAR 933.211, §§ 14, 15, 20 (Fassung in Kraft seit 30.08.2025); eidg. JSG Art. 5 / JSV Art. 3bis",
    "url": "https://gesetzessammlungen.ag.ch/app/de/texts_of_law/933.211",
    "retrieved": "2026-10-02"
  },
  "confidence": "high",
  "remarks": "Revierjagd. AJSV § 14: Reh (Bock, Schmalreh, Galtgeiss) 1.5–31.12, Rehgeiss/Kitz 1.9–31.12; Rothirsch 1.8–14.9 und 16.10–31.12; Gämse 1.8–31.12; Januar-Abschüsse Reh/Rothirsch nur auf Verfügung der Fachstelle. § 20: Baummarder und Waldschnepfe kantonal geschützt; laktierende Bachen 1.4–30.9, führende Rothirsch-Alttiere und Gamsgeissen geschützt. Bewegungsjagden 1.10–31.12, auf Wildschweine bis 31.1. Im Übrigen gelten die bundesrechtlichen Jagd-/Schonzeiten (JSG Art. 5, JSV Art. 3bis) – als Default abgebildet.",
  "species": [
    {
      "name": "Reh",
      "category": "",
      "scientificName": "Capreolus capreolus",
      "openSeason": [
        {
          "from": "05-01",
          "to": "12-31"
        }
      ],
      "protectedAllYear": false,
      "note": "AJSV § 14 Abs. 1: Bock, Schmalreh, Galtgeiss 1.5–31.12; Rehgeiss und Kitz 1.9–31.12; Januar nur auf Verfügung der Fachstelle",
      "id": "reh"
    },
    {
      "name": "Rothirsch",
      "category": "",
      "scientificName": "Cervus elaphus",
      "openSeason": [
        {
          "from": "08-01",
          "to": "09-14"
        },
        {
          "from": "10-16",
          "to": "12-31"
        }
      ],
      "protectedAllYear": false,
      "note": "AJSV § 14 Abs. 1bis; Januar nur auf Verfügung der Fachstelle (§ 14 Abs. 1quater); führende Alttiere geschützt; Bewegungsjagd 1.10–31.12",
      "id": "rothirsch"
    },
    {
      "name": "Wildschwein",
      "category": "",
      "scientificName": "Sus scrofa",
      "openSeason": [
        {
          "from": "07-01",
          "to": "02-28"
        }
      ],
      "protectedAllYear": false,
      "note": "eidg. Rahmen; laktierende Bachen 1.4–30.9 geschützt (AJSV § 20 Abs. 2); Bewegungsjagd bis 31.1; Frischlinge/Überläufer ausserhalb Wald ganzjährig",
      "id": "wildschwein"
    },
    {
      "name": "Feldhase",
      "category": "",
      "scientificName": "Lepus europaeus",
      "openSeason": [
        {
          "from": "10-01",
          "to": "12-31"
        }
      ],
      "protectedAllYear": false,
      "note": "wahrscheinlich – eidg. Rahmen gilt (AJSV § 14 Abs. 2); kantonal nicht geschützt (§ 20)",
      "id": "feldhase"
    },
    {
      "name": "Fuchs",
      "category": "",
      "scientificName": "Vulpes vulpes",
      "openSeason": [
        {
          "from": "06-16",
          "to": "02-28"
        }
      ],
      "protectedAllYear": false,
      "note": "eidg. Default",
      "id": "fuchs"
    },
    {
      "name": "Dachs",
      "category": "",
      "scientificName": "Meles meles",
      "openSeason": [
        {
          "from": "06-16",
          "to": "01-15"
        }
      ],
      "protectedAllYear": false,
      "note": "eidg. Default",
      "id": "dachs"
    },
    {
      "name": "Steinmarder",
      "category": "",
      "scientificName": "Martes foina",
      "openSeason": [
        {
          "from": "09-01",
          "to": "02-15"
        }
      ],
      "protectedAllYear": false,
      "note": "eidg. Default",
      "id": "steinmarder"
    },
    {
      "name": "Baummarder",
      "category": "",
      "scientificName": "Martes martes",
      "openSeason": [],
      "protectedAllYear": true,
      "note": "kantonal geschützt (AJSV § 20 Abs. 1 lit. a)",
      "id": "baummarder"
    },
    {
      "name": "Stockente",
      "category": "",
      "scientificName": "Anas platyrhynchos",
      "openSeason": [
        {
          "from": "09-01",
          "to": "01-31"
        }
      ],
      "protectedAllYear": false,
      "note": "eidg. Default",
      "id": "stockente"
    },
    {
      "name": "Blässhuhn",
      "category": "",
      "scientificName": "Fulica atra",
      "openSeason": [
        {
          "from": "09-01",
          "to": "01-31"
        }
      ],
      "protectedAllYear": false,
      "note": "eidg. Default",
      "id": "blaesshuhn"
    },
    {
      "name": "Ringeltaube",
      "category": "",
      "scientificName": "Columba palumbus",
      "openSeason": [
        {
          "from": "08-01",
          "to": "02-15"
        }
      ],
      "protectedAllYear": false,
      "note": "eidg. Default",
      "id": "ringeltaube"
    },
    {
      "name": "Türkentaube",
      "category": "",
      "scientificName": "Streptopelia decaocto",
      "openSeason": [
        {
          "from": "08-01",
          "to": "02-15"
        }
      ],
      "protectedAllYear": false,
      "note": "eidg. Default",
      "id": "tuerkentaube"
    },
    {
      "name": "Waldschnepfe",
      "category": "",
      "scientificName": "Scolopax rusticola",
      "openSeason": [],
      "protectedAllYear": true,
      "note": "kantonal geschützt (AJSV § 20 Abs. 1 lit. b)",
      "id": "waldschnepfe"
    },
    {
      "name": "Rabenkrähe",
      "category": "",
      "scientificName": "Corvus corone",
      "openSeason": [
        {
          "from": "08-01",
          "to": "02-15"
        }
      ],
      "protectedAllYear": false,
      "note": "eidg. Default",
      "id": "rabenkraehe"
    },
    {
      "name": "Elster",
      "category": "",
      "scientificName": "Pica pica",
      "openSeason": [
        {
          "from": "08-01",
          "to": "02-15"
        }
      ],
      "protectedAllYear": false,
      "note": "eidg. Default",
      "id": "elster"
    },
    {
      "name": "Eichelhäher",
      "category": "",
      "scientificName": "Garrulus glandarius",
      "openSeason": [
        {
          "from": "08-01",
          "to": "02-15"
        }
      ],
      "protectedAllYear": false,
      "note": "eidg. Default",
      "id": "eichelhaeher"
    },
    {
      "name": "Gämse",
      "category": "",
      "scientificName": "Rupicapra rupicapra",
      "openSeason": [
        {
          "from": "08-01",
          "to": "12-31"
        }
      ],
      "protectedAllYear": false,
      "note": "AJSV § 14 Abs. 1ter; führende Geissen geschützt (§ 20 Abs. 2bis)",
      "id": "gaemse"
    },
    {
      "name": "Iltis",
      "category": "",
      "scientificName": "Mustela putorius",
      "openSeason": [],
      "protectedAllYear": true,
      "note": "nicht jagdbar – geschützt",
      "id": "iltis"
    },
    {
      "name": "Hermelin",
      "category": "",
      "scientificName": "Mustela erminea",
      "openSeason": [],
      "protectedAllYear": true,
      "note": "nicht jagdbar – geschützt",
      "id": "hermelin"
    }
  ]
}
