{
  "region": {
    "code": "CH-BS",
    "country": "CH",
    "name": "Basel-Stadt",
    "system": "revier"
  },
  "validFrom": "2026-04-01",
  "source": {
    "title": "Ausübung der Jagd im Jagdjahr 2026/27 im Kanton Basel-Landschaft und Kanton Basel-Stadt (Amt für Wald und Wild beider Basel, 18.03.2026); Wildtier- und Jagdverordnung Basel-Stadt (WJV, SG 912.210) § 6",
    "url": "https://bl-api.webcloud7.ch/politik-und-behorden/direktionen/volkswirtschafts-und-gesundheitsdirektion/amt-fuer-wald-beider-basel/jagd/media-folder-jagd/fj-jagdzeiten-bl-2026-27_v2-260318_def.pdf",
    "retrieved": "2026-10-02"
  },
  "confidence": "medium",
  "remarks": "Stadtkanton mit Revierjagd; Regulierung weitgehend durch die Wildhut. Jagdzeiten seit dem Jagdjahr 2026/27 (01.04.2026–31.03.2027) im gemeinsamen Merkblatt BL/BS festgelegt – jährlich neu festgelegt. Die WJV (§ 6) stellt zusätzlich Baummarder, Feldhase, Birkhuhn, Rebhuhn, Haselhuhn, Waldschnepfe, Haubentaucher, Blässhuhn und alle Wildenten ausser der Stockente ganzjährig unter Schutz. Nachtjagd auf Schwarzwild, Fuchs, Dachs, Steinmarder, Waschbär und Marderhund erlaubt (WJV § 28).",
  "species": [
    {
      "name": "Reh",
      "category": "",
      "scientificName": "Capreolus capreolus",
      "openSeason": [
        {
          "from": "05-01",
          "to": "12-31"
        }
      ],
      "protectedAllYear": false,
      "note": "wahrscheinlich – lt. Merkblatt BL/BS 2026/27: Ansitz/Pirsch 01.05.–31.12., freie laute Jagd 01.10.–31.12.; Elterntiere mit unselbständigem Nachwuchs geschont",
      "id": "reh"
    },
    {
      "name": "Wildschwein",
      "category": "",
      "scientificName": "Sus scrofa",
      "openSeason": [
        {
          "from": "07-01",
          "to": "02-28"
        }
      ],
      "protectedAllYear": false,
      "note": "Schonzeit 01.03.–30.06. (JSV Art. 3bis); unter 2-jährig ausserhalb Wald keine Schonzeit. Nachtjagd erlaubt (WJV § 28). Hinweis (Wert unverändert, Abgrenzung unsicher): lt. Merkblatt BL/BS 2026/27 Ansitz/Pirsch ab 01.09., Drückjagden in landw. Kulturen 01.07.–30.09., Frischlinge/Überläufer auf dem Feld ganzjährig",
      "id": "wildschwein"
    },
    {
      "name": "Fuchs",
      "category": "",
      "scientificName": "Vulpes vulpes",
      "openSeason": [
        {
          "from": "06-16",
          "to": "02-28"
        }
      ],
      "protectedAllYear": false,
      "note": "Merkblatt BL/BS 2026/27; Nachtjagd erlaubt (WJV § 28)",
      "id": "fuchs"
    },
    {
      "name": "Dachs",
      "category": "",
      "scientificName": "Meles meles",
      "openSeason": [
        {
          "from": "06-16",
          "to": "01-15"
        }
      ],
      "protectedAllYear": false,
      "note": "Merkblatt BL/BS 2026/27; Nachtjagd erlaubt (WJV § 28)",
      "id": "dachs"
    },
    {
      "name": "Steinmarder",
      "category": "",
      "scientificName": "Martes foina",
      "openSeason": [
        {
          "from": "09-01",
          "to": "02-15"
        }
      ],
      "protectedAllYear": false,
      "note": "Merkblatt BL/BS 2026/27; Nachtjagd erlaubt (WJV § 28). Baummarder ist in BS ganzjährig geschützt",
      "id": "steinmarder"
    },
    {
      "name": "Marderhund",
      "category": "",
      "scientificName": "Nyctereutes procyonoides",
      "openSeason": [
        {
          "from": "01-01",
          "to": "12-31"
        }
      ],
      "protectedAllYear": false,
      "note": "Ganzjähriges Jagdgebot, Muttertierschutz (Merkblatt BL/BS 2026/27; JSG Art. 5 Abs. 3). Nachtjagd erlaubt (WJV § 28)",
      "id": "marderhund"
    },
    {
      "name": "Waschbär",
      "category": "",
      "scientificName": "Procyon lotor",
      "openSeason": [
        {
          "from": "01-01",
          "to": "12-31"
        }
      ],
      "protectedAllYear": false,
      "note": "Ganzjähriges Jagdgebot, Muttertierschutz (Merkblatt BL/BS 2026/27; JSG Art. 5 Abs. 3). Nachtjagd erlaubt (WJV § 28)",
      "id": "waschbaer"
    },
    {
      "name": "Stockente",
      "category": "",
      "scientificName": "Anas platyrhynchos",
      "openSeason": [
        {
          "from": "09-01",
          "to": "01-31"
        }
      ],
      "protectedAllYear": false,
      "note": "Merkblatt BL/BS 2026/27. In BS ist nur die Stockente jagdbar – alle übrigen Wildenten sind kantonal geschützt (WJV § 6)",
      "id": "stockente"
    },
    {
      "name": "Ringeltaube",
      "category": "",
      "scientificName": "Columba palumbus",
      "openSeason": [
        {
          "from": "08-01",
          "to": "02-15"
        }
      ],
      "protectedAllYear": false,
      "note": "Merkblatt BL/BS 2026/27",
      "id": "ringeltaube"
    },
    {
      "name": "Türkentaube",
      "category": "",
      "scientificName": "Streptopelia decaocto",
      "openSeason": [
        {
          "from": "08-01",
          "to": "02-15"
        }
      ],
      "protectedAllYear": false,
      "note": "Merkblatt BL/BS 2026/27",
      "id": "tuerkentaube"
    },
    {
      "name": "Verwilderte Haustaube",
      "category": "",
      "scientificName": "Columba livia f. domestica",
      "openSeason": [
        {
          "from": "01-01",
          "to": "12-31"
        }
      ],
      "protectedAllYear": false,
      "note": "Ganzjährig jagdbar (Merkblatt BL/BS 2026/27)",
      "id": "verwilderte-haustaube"
    },
    {
      "name": "Rabenkrähe",
      "category": "",
      "scientificName": "Corvus corone",
      "openSeason": [
        {
          "from": "08-01",
          "to": "02-15"
        }
      ],
      "protectedAllYear": false,
      "note": "Merkblatt BL/BS 2026/27; bei Schwärmen auf schadengefährdeten Kulturen keine Schonzeit",
      "id": "rabenkraehe"
    },
    {
      "name": "Elster",
      "category": "",
      "scientificName": "Pica pica",
      "openSeason": [
        {
          "from": "08-01",
          "to": "02-15"
        }
      ],
      "protectedAllYear": false,
      "note": "Merkblatt BL/BS 2026/27",
      "id": "elster"
    },
    {
      "name": "Eichelhäher",
      "category": "",
      "scientificName": "Garrulus glandarius",
      "openSeason": [
        {
          "from": "08-01",
          "to": "02-15"
        }
      ],
      "protectedAllYear": false,
      "note": "Merkblatt BL/BS 2026/27",
      "id": "eichelhaeher"
    },
    {
      "name": "Baummarder",
      "category": "",
      "scientificName": "Martes martes",
      "openSeason": [],
      "protectedAllYear": true,
      "note": "In Basel-Stadt ganzjährig geschützt (WJV § 6 lit. a)",
      "id": "baummarder"
    },
    {
      "name": "Feldhase",
      "category": "",
      "scientificName": "Lepus europaeus",
      "openSeason": [],
      "protectedAllYear": true,
      "note": "In Basel-Stadt ganzjährig geschützt (WJV § 6 lit. b)",
      "id": "feldhase"
    },
    {
      "name": "Birkhahn",
      "category": "",
      "scientificName": "Lyrurus tetrix",
      "openSeason": [],
      "protectedAllYear": true,
      "note": "Birkhuhn in Basel-Stadt ganzjährig geschützt (WJV § 6 lit. c)",
      "id": "birkhahn"
    },
    {
      "name": "Rebhuhn",
      "category": "",
      "scientificName": "Perdix perdix",
      "openSeason": [],
      "protectedAllYear": true,
      "note": "Ganzjährig geschützt (WJV § 6 lit. d; zudem bundesrechtlich JSV Art. 3bis)",
      "id": "rebhuhn"
    },
    {
      "name": "Haselhuhn",
      "category": "",
      "scientificName": "Tetrastes bonasia",
      "openSeason": [],
      "protectedAllYear": true,
      "note": "In Basel-Stadt ganzjährig geschützt (WJV § 6 lit. e)",
      "id": "haselhuhn"
    },
    {
      "name": "Waldschnepfe",
      "category": "",
      "scientificName": "Scolopax rusticola",
      "openSeason": [],
      "protectedAllYear": true,
      "note": "In Basel-Stadt ganzjährig geschützt (WJV § 6 lit. f)",
      "id": "waldschnepfe"
    },
    {
      "name": "Haubentaucher",
      "category": "",
      "scientificName": "Podiceps cristatus",
      "openSeason": [],
      "protectedAllYear": true,
      "note": "In Basel-Stadt ganzjährig geschützt (WJV § 6 lit. g)",
      "id": "haubentaucher"
    },
    {
      "name": "Blässhuhn",
      "category": "",
      "scientificName": "Fulica atra",
      "openSeason": [],
      "protectedAllYear": true,
      "note": "In Basel-Stadt ganzjährig geschützt (WJV § 6 lit. h)",
      "id": "blaesshuhn"
    },
    {
      "name": "Kormoran",
      "category": "",
      "scientificName": "Phalacrocorax carbo",
      "openSeason": [
        {
          "from": "09-01",
          "to": "02-28"
        }
      ],
      "protectedAllYear": false,
      "note": "Merkblatt BL/BS 2026/27",
      "id": "kormoran"
    },
    {
      "name": "Saatkrähe",
      "category": "",
      "scientificName": "Corvus frugilegus",
      "openSeason": [
        {
          "from": "08-01",
          "to": "02-15"
        }
      ],
      "protectedAllYear": false,
      "note": "Merkblatt BL/BS 2026/27",
      "id": "saatkraehe"
    },
    {
      "name": "Nebelkrähe",
      "category": "",
      "scientificName": "Corvus cornix",
      "openSeason": [
        {
          "from": "08-01",
          "to": "02-15"
        }
      ],
      "protectedAllYear": false,
      "note": "Merkblatt BL/BS 2026/27",
      "id": "nebelkraehe"
    },
    {
      "name": "Kolkrabe",
      "category": "",
      "scientificName": "Corvus corax",
      "openSeason": [
        {
          "from": "08-01",
          "to": "02-15"
        }
      ],
      "protectedAllYear": false,
      "note": "Merkblatt BL/BS 2026/27",
      "id": "kolkrabe"
    }
  ]
}
