{
  "region": {
    "code": "CH-VD",
    "country": "CH",
    "name": "Waadt",
    "system": "patent"
  },
  "validFrom": "2026-07-03",
  "source": {
    "title": "État de Vaud – Directives du 3 juillet 2026 sur la chasse en 2026-2027 (Annexe I/I bis, jours de chasse); DGE-BIODIV",
    "url": "https://www.vd.ch/fileadmin/user_upload/themes/environnement/biodiversite/fichiers_pdf/chasse/Actualit%C3%A9/Directives_chasse_2026_2027_01.pdf",
    "retrieved": "2026-10-02"
  },
  "confidence": "high",
  "remarks": "Patentjagd mit Tages-/Permit-System (A Générale, B Cerf, C Chamois, D/E Restreintes, F Piégeage, G/H/I Seen). Angegebene Daten = Eröffnungs-/Schliessungsrahmen Saison 2026-2027; innerhalb gelten festgelegte Jagdtage. Cerf/Chamois in Etappen (Alpen/Jura/Plaine), Teilnahme per Losverfahren. Bouquetin nur Regulierung (24.–26.08.2026 nach décision départementale).",
  "species": [
    {
      "name": "Rothirsch",
      "category": "",
      "scientificName": "Cervus elaphus",
      "openSeason": [
        {
          "from": "09-01",
          "to": "12-12"
        }
      ],
      "protectedAllYear": false,
      "note": "Cerf: Equipe Alpes/Plaine 1.–5./7.–11.09, Nov., 1.–12.12; Jura 1.–3.09 bis 10.12; Einzeljagd 1.10–11.12; nur an festgelegten Tagen",
      "id": "rothirsch"
    },
    {
      "name": "Reh",
      "category": "",
      "scientificName": "Capreolus capreolus",
      "openSeason": [
        {
          "from": "10-01",
          "to": "10-31"
        }
      ],
      "protectedAllYear": false,
      "note": "Chevreuil (permis A) 1.–30.10 Mo–Fr; Affût/Approche bis 31.10 inkl. Sa",
      "id": "reh"
    },
    {
      "name": "Gämse",
      "category": "",
      "scientificName": "Rupicapra rupicapra",
      "openSeason": [
        {
          "from": "09-14",
          "to": "12-18"
        }
      ],
      "protectedAllYear": false,
      "note": "Chamois Alpen 14.–18./21.–24.09; Jura/Plaine 17.–18.09 und 17.–18.12; nur an festgelegten Tagen",
      "id": "gaemse"
    },
    {
      "name": "Steinbock",
      "category": "",
      "scientificName": "Capra ibex",
      "openSeason": [],
      "protectedAllYear": true,
      "note": "nur Regulierung nach Art. 7a JSG (VD 2026: Tir du bouquetin 24.–26.08 nach décision départementale)",
      "id": "steinbock"
    },
    {
      "name": "Wildschwein",
      "category": "",
      "scientificName": "Sus scrofa",
      "openSeason": [
        {
          "from": "08-03",
          "to": "01-30"
        },
        {
          "from": "06-01",
          "to": "07-31"
        }
      ],
      "protectedAllYear": false,
      "note": "Sanglier: Affût/Approche 3.8–29.9 und 2.11–30.1; Okt. permis A; permis D 1.9–29.9 + 2.11–30.1; zusätzlich 1.6–31.7.2027 Affût/Approche ausserhalb Wald (Juni nur <50 kg); Februar-Verlängerung möglich (Art. 30)",
      "id": "wildschwein"
    },
    {
      "name": "Feldhase",
      "category": "",
      "scientificName": "Lepus europaeus",
      "openSeason": [
        {
          "from": "10-05",
          "to": "10-16"
        }
      ],
      "protectedAllYear": false,
      "note": "Lièvre brun 5.–16.10 (permis A)",
      "id": "feldhase"
    },
    {
      "name": "Fuchs",
      "category": "",
      "scientificName": "Vulpes vulpes",
      "openSeason": [
        {
          "from": "09-01",
          "to": "01-29"
        }
      ],
      "protectedAllYear": false,
      "note": "Renard 1.9.2026–29.1.2027 (permis A); Piégeage (F) 3.11–29.1",
      "id": "fuchs"
    },
    {
      "name": "Dachs",
      "category": "",
      "scientificName": "Meles meles",
      "openSeason": [
        {
          "from": "09-01",
          "to": "01-15"
        }
      ],
      "protectedAllYear": false,
      "note": "Blaireau 1.9.2026–15.1.2027 (permis A)",
      "id": "dachs"
    },
    {
      "name": "Steinmarder",
      "category": "",
      "scientificName": "Martes foina",
      "openSeason": [
        {
          "from": "09-01",
          "to": "01-29"
        }
      ],
      "protectedAllYear": false,
      "note": "Fouine 1.9.2026–29.1.2027 (permis A/D); Baummarder nicht genannt",
      "id": "steinmarder"
    },
    {
      "name": "Stockente",
      "category": "",
      "scientificName": "Anas platyrhynchos",
      "openSeason": [
        {
          "from": "10-01",
          "to": "01-30"
        }
      ],
      "protectedAllYear": false,
      "note": "Canard colvert: 1.–30.10 (A), 2.11–29.1 (E); Léman 1.10–29.1, Neuchâtel/Morat 1.10–30.1",
      "id": "stockente"
    },
    {
      "name": "Blässhuhn",
      "category": "",
      "scientificName": "Fulica atra",
      "openSeason": [
        {
          "from": "10-01",
          "to": "01-29"
        }
      ],
      "protectedAllYear": false,
      "note": "Foulque macroule: 1.–30.10 (A) + 2.11–29.1 (E)",
      "id": "blaesshuhn"
    },
    {
      "name": "Waldschnepfe",
      "category": "",
      "scientificName": "Scolopax rusticola",
      "openSeason": [
        {
          "from": "11-02",
          "to": "12-14"
        }
      ],
      "protectedAllYear": false,
      "note": "Bécasse 2.11–14.12 (permis A/E)",
      "id": "waldschnepfe"
    },
    {
      "name": "Ringeltaube",
      "category": "",
      "scientificName": "Columba palumbus",
      "openSeason": [
        {
          "from": "09-01",
          "to": "02-15"
        }
      ],
      "protectedAllYear": false,
      "note": "Pigeon ramier 1.9.2026–15.2.2027 (permis A)",
      "id": "ringeltaube"
    },
    {
      "name": "Türkentaube",
      "category": "",
      "scientificName": "Streptopelia decaocto",
      "openSeason": [
        {
          "from": "09-01",
          "to": "02-15"
        }
      ],
      "protectedAllYear": false,
      "note": "Tourterelle turque 1.9.2026–15.2.2027 (permis A)",
      "id": "tuerkentaube"
    },
    {
      "name": "Rabenkrähe",
      "category": "",
      "scientificName": "Corvus corone",
      "openSeason": [
        {
          "from": "09-01",
          "to": "02-15"
        },
        {
          "from": "03-15",
          "to": "06-29"
        }
      ],
      "protectedAllYear": false,
      "note": "Corneille noire 1.9.2026–15.2.2027; Schwärme in Kulturen zusätzlich 15.3–29.6.2027",
      "id": "rabenkraehe"
    },
    {
      "name": "Elster",
      "category": "",
      "scientificName": "Pica pica",
      "openSeason": [
        {
          "from": "09-01",
          "to": "02-15"
        }
      ],
      "protectedAllYear": false,
      "note": "Pie 1.9.2026–15.2.2027 (permis A)",
      "id": "elster"
    },
    {
      "name": "Eichelhäher",
      "category": "",
      "scientificName": "Garrulus glandarius",
      "openSeason": [],
      "protectedAllYear": true,
      "note": "geai in VD-Annexe nicht als jagdbar gelistet – geschützt",
      "id": "eichelhaeher"
    },
    {
      "name": "Schneehase",
      "category": "",
      "scientificName": "Lepus timidus",
      "openSeason": [],
      "protectedAllYear": true,
      "note": "nicht gelistet – geschützt/unbestätigt",
      "id": "schneehase"
    },
    {
      "name": "Murmeltier",
      "category": "",
      "scientificName": "Marmota marmota",
      "openSeason": [],
      "protectedAllYear": true,
      "note": "in VD-Annexe nicht als jagdbar gelistet",
      "id": "murmeltier"
    },
    {
      "name": "Birkhahn",
      "category": "",
      "scientificName": "Lyrurus tetrix",
      "openSeason": [],
      "protectedAllYear": true,
      "note": "in VD nicht jagdbar gelistet – geschützt",
      "id": "birkhahn"
    },
    {
      "name": "Iltis",
      "category": "",
      "scientificName": "Mustela putorius",
      "openSeason": [],
      "protectedAllYear": true,
      "note": "nicht jagdbar – geschützt",
      "id": "iltis"
    },
    {
      "name": "Hermelin",
      "category": "",
      "scientificName": "Mustela erminea",
      "openSeason": [],
      "protectedAllYear": true,
      "note": "nicht jagdbar – geschützt",
      "id": "hermelin"
    }
  ]
}
