{
  "region": {
    "code": "CH-ZH",
    "country": "CH",
    "name": "Zürich",
    "system": "revier"
  },
  "validFrom": "2025-09-01",
  "source": {
    "title": "Kantonale Jagdverordnung (JV) LS 922.11, § 27 (Jagdbare Arten und Jagdzeiten), Fassung in Kraft seit 01.09.2025 (Änderung RRB 18.06.2025, OS 80, 206)",
    "url": "https://www.zh.ch/de/politik-staat/gesetze-beschluesse/gesetzessammlung/zhlex-os/erlass-922_11-80-206.html",
    "retrieved": "2026-10-02"
  },
  "confidence": "high",
  "remarks": "Revierjagd. Daten aus § 27 JV in der seit 01.09.2025 geltenden Fassung (RRB 18.06.2025): Türkentaube, Elster und Eichelhäher sind seither nicht mehr jagdbar. 'Ende Februar' als 02-28 erfasst. Rothirsch/Gämse nur gemäss ALN-Weisung. Laktierende führende Bachen geschützt. Keine Wasservogeljagd in Auen-, Moor- und Amphibienlaichgebieten nationaler Bedeutung sowie überkommunalen Feuchtgebieten (§ 27 Abs. 4).",
  "species": [
    {
      "name": "Reh",
      "category": "Rehböcke, Schmalrehe, Galtgeissen",
      "scientificName": "Capreolus capreolus",
      "openSeason": [
        {
          "from": "05-02",
          "to": "12-31"
        }
      ],
      "protectedAllYear": false,
      "note": "",
      "id": "reh-rehboecke-schmalrehe-galtgeissen"
    },
    {
      "name": "Reh",
      "category": "Rehgeissen und Rehkitze",
      "scientificName": "Capreolus capreolus",
      "openSeason": [
        {
          "from": "09-01",
          "to": "12-31"
        }
      ],
      "protectedAllYear": false,
      "note": "",
      "id": "reh-rehgeissen-und-rehkitze"
    },
    {
      "name": "Wildschwein",
      "category": "",
      "scientificName": "Sus scrofa",
      "openSeason": [
        {
          "from": "07-01",
          "to": "02-28"
        }
      ],
      "protectedAllYear": false,
      "note": "Laktierende führende Bachen geschützt; über ganzjährigen Abschuss von Wildschweinen unter 2 Jahren ausserhalb des Waldes entscheidet das ALN (§ 27 Abs. 2)",
      "id": "wildschwein"
    },
    {
      "name": "Rothirsch",
      "category": "",
      "scientificName": "Cervus elaphus",
      "openSeason": [
        {
          "from": "08-02",
          "to": "12-31"
        }
      ],
      "protectedAllYear": false,
      "note": "Nur gemäss Weisung des ALN",
      "id": "rothirsch"
    },
    {
      "name": "Damhirsch",
      "category": "",
      "scientificName": "Dama dama",
      "openSeason": [
        {
          "from": "08-02",
          "to": "01-31"
        }
      ],
      "protectedAllYear": false,
      "note": "",
      "id": "damhirsch"
    },
    {
      "name": "Sikahirsch",
      "category": "",
      "scientificName": "Cervus nippon",
      "openSeason": [
        {
          "from": "08-02",
          "to": "01-31"
        }
      ],
      "protectedAllYear": false,
      "note": "",
      "id": "sikahirsch"
    },
    {
      "name": "Gämse",
      "category": "",
      "scientificName": "Rupicapra rupicapra",
      "openSeason": [
        {
          "from": "08-02",
          "to": "12-31"
        }
      ],
      "protectedAllYear": false,
      "note": "Nur gemäss Weisung des ALN",
      "id": "gaemse"
    },
    {
      "name": "Fuchs",
      "category": "",
      "scientificName": "Vulpes vulpes",
      "openSeason": [
        {
          "from": "06-16",
          "to": "02-28"
        }
      ],
      "protectedAllYear": false,
      "note": "",
      "id": "fuchs"
    },
    {
      "name": "Dachs",
      "category": "",
      "scientificName": "Meles meles",
      "openSeason": [
        {
          "from": "06-16",
          "to": "01-15"
        }
      ],
      "protectedAllYear": false,
      "note": "",
      "id": "dachs"
    },
    {
      "name": "Steinmarder",
      "category": "",
      "scientificName": "Martes foina",
      "openSeason": [
        {
          "from": "09-01",
          "to": "02-15"
        }
      ],
      "protectedAllYear": false,
      "note": "",
      "id": "steinmarder"
    },
    {
      "name": "Stockente",
      "category": "",
      "scientificName": "Anas platyrhynchos",
      "openSeason": [
        {
          "from": "09-01",
          "to": "01-31"
        }
      ],
      "protectedAllYear": false,
      "note": "",
      "id": "stockente"
    },
    {
      "name": "Kormoran",
      "category": "",
      "scientificName": "Phalacrocorax carbo",
      "openSeason": [
        {
          "from": "09-01",
          "to": "01-31"
        }
      ],
      "protectedAllYear": false,
      "note": "",
      "id": "kormoran"
    },
    {
      "name": "Ringeltaube",
      "category": "",
      "scientificName": "Columba palumbus",
      "openSeason": [
        {
          "from": "08-02",
          "to": "02-15"
        }
      ],
      "protectedAllYear": false,
      "note": "",
      "id": "ringeltaube"
    },
    {
      "name": "Türkentaube",
      "category": "",
      "scientificName": "Streptopelia decaocto",
      "openSeason": [],
      "protectedAllYear": true,
      "note": "Seit 01.09.2025 nicht mehr in § 27 JV aufgeführt (RRB 18.06.2025) – im Kt. ZH nicht jagdbar (Einschränkung nach Art. 5 Abs. 4 JSG)",
      "id": "tuerkentaube"
    },
    {
      "name": "Rabenkrähe",
      "category": "",
      "scientificName": "Corvus corone",
      "openSeason": [
        {
          "from": "08-02",
          "to": "02-15"
        }
      ],
      "protectedAllYear": false,
      "note": "Bei Schwärmen auf schadengefährdeten Kulturen keine Schonzeit",
      "id": "rabenkraehe"
    },
    {
      "name": "Saatkrähe",
      "category": "",
      "scientificName": "Corvus frugilegus",
      "openSeason": [
        {
          "from": "08-02",
          "to": "02-15"
        }
      ],
      "protectedAllYear": false,
      "note": "",
      "id": "saatkraehe"
    },
    {
      "name": "Nebelkrähe",
      "category": "",
      "scientificName": "Corvus cornix",
      "openSeason": [
        {
          "from": "08-02",
          "to": "02-15"
        }
      ],
      "protectedAllYear": false,
      "note": "",
      "id": "nebelkraehe"
    },
    {
      "name": "Elster",
      "category": "",
      "scientificName": "Pica pica",
      "openSeason": [],
      "protectedAllYear": true,
      "note": "Seit 01.09.2025 nicht mehr in § 27 JV aufgeführt (RRB 18.06.2025) – im Kt. ZH nicht jagdbar (Einschränkung nach Art. 5 Abs. 4 JSG)",
      "id": "elster"
    },
    {
      "name": "Eichelhäher",
      "category": "",
      "scientificName": "Garrulus glandarius",
      "openSeason": [],
      "protectedAllYear": true,
      "note": "Seit 01.09.2025 nicht mehr in § 27 JV aufgeführt (RRB 18.06.2025) – im Kt. ZH nicht jagdbar (Einschränkung nach Art. 5 Abs. 4 JSG)",
      "id": "eichelhaeher"
    },
    {
      "name": "Feldhase",
      "category": "",
      "scientificName": "Lepus europaeus",
      "openSeason": [],
      "protectedAllYear": true,
      "note": "Nicht in § 27 JV ZH als jagdbar aufgeführt; im Kt. ZH faktisch nicht bejagt",
      "id": "feldhase"
    },
    {
      "name": "Marderhund",
      "category": "",
      "scientificName": "Nyctereutes procyonoides",
      "openSeason": [
        {
          "from": "01-01",
          "to": "12-31"
        }
      ],
      "protectedAllYear": false,
      "note": "Nicht einheimisches Wildtier, ganzjährig (§ 27 lit. l)",
      "id": "marderhund"
    },
    {
      "name": "Waschbär",
      "category": "",
      "scientificName": "Procyon lotor",
      "openSeason": [
        {
          "from": "01-01",
          "to": "12-31"
        }
      ],
      "protectedAllYear": false,
      "note": "Nicht einheimisches Wildtier, ganzjährig (§ 27 lit. l)",
      "id": "waschbaer"
    },
    {
      "name": "Verwilderte Hauskatze",
      "category": "",
      "scientificName": "Felis catus",
      "openSeason": [
        {
          "from": "01-01",
          "to": "12-31"
        }
      ],
      "protectedAllYear": false,
      "note": "ganzjährig (§ 27 lit. l)",
      "id": "verwilderte-hauskatze"
    },
    {
      "name": "Verwilderte Haustaube",
      "category": "",
      "scientificName": "Columba livia f. domestica",
      "openSeason": [
        {
          "from": "01-01",
          "to": "12-31"
        }
      ],
      "protectedAllYear": false,
      "note": "ganzjährig (§ 27 lit. l)",
      "id": "verwilderte-haustaube"
    }
  ]
}
