{
  "region": {
    "code": "CH-VS",
    "country": "CH",
    "name": "Wallis",
    "system": "patent"
  },
  "validFrom": "2026-07-01",
  "source": {
    "title": "Canton du Valais – Arrêté sur l'exercice de la chasse en Valais 2026-2027, RS 922.110 (Annexe 1, dates de chasse), du 17.06.2026, mod. 08.07.2026; SCPF",
    "url": "https://lex.vs.ch/app/fr/texts_of_law/922.110",
    "retrieved": "2026-10-02"
  },
  "confidence": "high",
  "remarks": "Klassischer Patentjagd-Kanton. Permits A (haute chasse), B (basse chasse), C (gibier d'eau), E (petits prédateurs), S (sanglier spécial). Saison 2026-2027: haute chasse 21.09–03.10.2026, basse chasse 06.10–28.11.2026, gibier d'eau bis 31.01.2027. Zahlreiche Kontingente/Sous-unités/Geschlechts-Alters-Regeln. Tirs complémentaires (Hirsch) durch die Wildhut. Bouquetin nur Regulierung (Directive SCPF).",
  "species": [
    {
      "name": "Rothirsch",
      "category": "",
      "scientificName": "Cervus elaphus",
      "openSeason": [
        {
          "from": "09-21",
          "to": "10-03"
        }
      ],
      "protectedAllYear": false,
      "note": "Haute chasse (permis A) 21.09–03.10.2026; Tirs complémentaires durch Wildhut (Art. 16)",
      "id": "rothirsch"
    },
    {
      "name": "Reh",
      "category": "",
      "scientificName": "Capreolus capreolus",
      "openSeason": [
        {
          "from": "09-21",
          "to": "10-03"
        },
        {
          "from": "10-06",
          "to": "10-24"
        }
      ],
      "protectedAllYear": false,
      "note": "Chevrette haute chasse 21.09–03.10 (max. 2 nicht säugende); Brocard basse chasse 06.–24.10 (Di+Sa)",
      "id": "reh"
    },
    {
      "name": "Gämse",
      "category": "",
      "scientificName": "Rupicapra rupicapra",
      "openSeason": [
        {
          "from": "09-21",
          "to": "10-03"
        }
      ],
      "protectedAllYear": false,
      "note": "Haute chasse 21.09–03.10; max. 3 Stück; Sous-unités mit Sonderregeln",
      "id": "gaemse"
    },
    {
      "name": "Steinbock",
      "category": "",
      "scientificName": "Capra ibex",
      "openSeason": [],
      "protectedAllYear": true,
      "note": "nur Regulierung nach Art. 7a JSG (Directive SCPF/DCRB, Art. 41 Arrêté)",
      "id": "steinbock"
    },
    {
      "name": "Wildschwein",
      "category": "",
      "scientificName": "Sus scrofa",
      "openSeason": [
        {
          "from": "09-21",
          "to": "11-28"
        },
        {
          "from": "12-05",
          "to": "02-06"
        }
      ],
      "protectedAllYear": false,
      "note": "Haute + basse chasse 21.09–28.11; permis S nur Samstage 5.12.2026–6.2.2027; laie allaitante geschützt",
      "id": "wildschwein"
    },
    {
      "name": "Feldhase",
      "category": "",
      "scientificName": "Lepus europaeus",
      "openSeason": [
        {
          "from": "10-06",
          "to": "11-28"
        }
      ],
      "protectedAllYear": false,
      "note": "Lièvre brun 6.10–28.11 (Art. 22 i. d. F. vom 08.07.2026); max. 4 Stück",
      "id": "feldhase"
    },
    {
      "name": "Schneehase",
      "category": "",
      "scientificName": "Lepus timidus",
      "openSeason": [
        {
          "from": "10-06",
          "to": "11-28"
        }
      ],
      "protectedAllYear": false,
      "note": "Lièvre variable 6.10–28.11 (Art. 22 i. d. F. vom 08.07.2026); max. 2 Stück",
      "id": "schneehase"
    },
    {
      "name": "Murmeltier",
      "category": "",
      "scientificName": "Marmota marmota",
      "openSeason": [
        {
          "from": "09-21",
          "to": "10-03"
        }
      ],
      "protectedAllYear": false,
      "note": "Marmotte haute chasse (permis A) 21.09–03.10; max. 5 Stück",
      "id": "murmeltier"
    },
    {
      "name": "Fuchs",
      "category": "",
      "scientificName": "Vulpes vulpes",
      "openSeason": [
        {
          "from": "09-21",
          "to": "02-27"
        }
      ],
      "protectedAllYear": false,
      "note": "Renard haute/basse chasse + permis C/E/S bis 27.2",
      "id": "fuchs"
    },
    {
      "name": "Dachs",
      "category": "",
      "scientificName": "Meles meles",
      "openSeason": [
        {
          "from": "09-21",
          "to": "01-15"
        }
      ],
      "protectedAllYear": false,
      "note": "Blaireau; geschützt ab 16.1",
      "id": "dachs"
    },
    {
      "name": "Steinmarder",
      "category": "",
      "scientificName": "Martes foina",
      "openSeason": [
        {
          "from": "10-06",
          "to": "02-15"
        }
      ],
      "protectedAllYear": false,
      "note": "Fouine; basse chasse ab 6.10, permis E bis 15.2; geschützt ab 16.2",
      "id": "steinmarder"
    },
    {
      "name": "Baummarder",
      "category": "",
      "scientificName": "Martes martes",
      "openSeason": [
        {
          "from": "10-06",
          "to": "02-15"
        }
      ],
      "protectedAllYear": false,
      "note": "Martre; basse chasse ab 6.10, permis E bis 15.2; geschützt ab 16.2",
      "id": "baummarder"
    },
    {
      "name": "Birkhahn",
      "category": "",
      "scientificName": "Lyrurus tetrix",
      "openSeason": [
        {
          "from": "10-16",
          "to": "11-28"
        }
      ],
      "protectedAllYear": false,
      "note": "Coq de tétras-lyre, chasse à l'arrêt; 16.–31.10 + 3.–28.11; max. 6, nur Hahn",
      "id": "birkhahn"
    },
    {
      "name": "Schneehuhn",
      "category": "",
      "scientificName": "Lagopus muta",
      "openSeason": [
        {
          "from": "10-16",
          "to": "11-28"
        }
      ],
      "protectedAllYear": false,
      "note": "Lagopède; chasse à l'arrêt 16.–31.10 + 3.–28.11; max. 6",
      "id": "schneehuhn"
    },
    {
      "name": "Steinhuhn",
      "category": "",
      "scientificName": "Alectoris graeca",
      "openSeason": [],
      "protectedAllYear": true,
      "note": "Perdrix bartavelle bundesrechtlich geschützt (nicht in JSG Art. 5 Abs. 1); im Arrêté nicht jagdbar",
      "id": "steinhuhn"
    },
    {
      "name": "Stockente",
      "category": "",
      "scientificName": "Anas platyrhynchos",
      "openSeason": [
        {
          "from": "11-03",
          "to": "01-31"
        }
      ],
      "protectedAllYear": false,
      "note": "Gibier d'eau (permis C) 3.11–28.11 + 1.12–31.1",
      "id": "stockente"
    },
    {
      "name": "Blässhuhn",
      "category": "",
      "scientificName": "Fulica atra",
      "openSeason": [
        {
          "from": "11-03",
          "to": "01-31"
        }
      ],
      "protectedAllYear": false,
      "note": "Foulque macroule, permis C",
      "id": "blaesshuhn"
    },
    {
      "name": "Waldschnepfe",
      "category": "",
      "scientificName": "Scolopax rusticola",
      "openSeason": [
        {
          "from": "10-20",
          "to": "11-28"
        }
      ],
      "protectedAllYear": false,
      "note": "Bécasse des bois, chasse à l'arrêt; 20.–31.10 + 3.–28.11; max. 15",
      "id": "waldschnepfe"
    },
    {
      "name": "Ringeltaube",
      "category": "",
      "scientificName": "Columba palumbus",
      "openSeason": [
        {
          "from": "10-06",
          "to": "11-28"
        }
      ],
      "protectedAllYear": false,
      "note": "Pigeon ramier, basse chasse (permis B)",
      "id": "ringeltaube"
    },
    {
      "name": "Türkentaube",
      "category": "",
      "scientificName": "Streptopelia decaocto",
      "openSeason": [
        {
          "from": "10-06",
          "to": "11-28"
        }
      ],
      "protectedAllYear": false,
      "note": "Tourterelle turque, basse chasse (permis B)",
      "id": "tuerkentaube"
    },
    {
      "name": "Rabenkrähe",
      "category": "",
      "scientificName": "Corvus corone",
      "openSeason": [
        {
          "from": "10-06",
          "to": "01-31"
        }
      ],
      "protectedAllYear": false,
      "note": "Corneille noire/mantelée, basse chasse + permis C",
      "id": "rabenkraehe"
    },
    {
      "name": "Elster",
      "category": "",
      "scientificName": "Pica pica",
      "openSeason": [
        {
          "from": "10-06",
          "to": "01-31"
        }
      ],
      "protectedAllYear": false,
      "note": "Pie; basse chasse + permis C",
      "id": "elster"
    },
    {
      "name": "Eichelhäher",
      "category": "",
      "scientificName": "Garrulus glandarius",
      "openSeason": [
        {
          "from": "10-06",
          "to": "01-31"
        }
      ],
      "protectedAllYear": false,
      "note": "Geai; basse chasse + permis C",
      "id": "eichelhaeher"
    },
    {
      "name": "Iltis",
      "category": "",
      "scientificName": "Mustela putorius",
      "openSeason": [],
      "protectedAllYear": true,
      "note": "nicht jagdbar – geschützt",
      "id": "iltis"
    },
    {
      "name": "Hermelin",
      "category": "",
      "scientificName": "Mustela erminea",
      "openSeason": [],
      "protectedAllYear": true,
      "note": "nicht jagdbar – geschützt",
      "id": "hermelin"
    }
  ]
}
