{
  "region": {
    "code": "CH-SH",
    "country": "CH",
    "name": "Schaffhausen",
    "system": "revier"
  },
  "validFrom": "2023-04-01",
  "source": {
    "title": "Verordnung über die Jagd und den Schutz wildlebender Säugetiere und Vögel des Kantons Schaffhausen (SHR 922.101) § 13 i.V.m. JSG Art. 5 und JSV Art. 3bis",
    "url": "https://rechtsbuch.sh.ch/app/de/texts_of_law/922.101",
    "retrieved": "2026-10-02"
  },
  "confidence": "high",
  "remarks": "Revierjagd. Jagdbare Arten und Schonzeiten richten sich nach Bundesrecht (§ 13 Abs. 1 JV, JSG Art. 5, JSV Art. 3bis) mit kantonalen Abweichungen (§ 13 Abs. 2, letzte Änderung 01.05.2021): weibliches Rehwild und Kitze zusätzlich 01.05.–31.08. geschont (ausser Galtgeiss/Schmalreh); Waldschnepfe, Fasanhenne, Kolkrabe, Wildenten ausser Stockente, Haubentaucher und Baummarder ganzjährig geschont. Muttertiere von Reh-, Hirsch- und Schwarzwild mit Jungen geschont (§ 14).",
  "species": [
    {
      "name": "Reh",
      "category": "Rehbock",
      "scientificName": "Capreolus capreolus",
      "openSeason": [
        {
          "from": "05-01",
          "to": "01-31"
        }
      ],
      "protectedAllYear": false,
      "note": "wahrscheinlich – Bundesrecht (JSG Art. 5: Schonzeit 01.02.–30.04.; Jagd Schaffhausen nennt 2. Mai). Weibliches Rehwild und Kitze erst ab 01.09. (ausser Galtgeiss/Schmalreh, § 13 Abs. 2 lit. a JV)",
      "id": "reh-rehbock"
    },
    {
      "name": "Wildschwein",
      "category": "",
      "scientificName": "Sus scrofa",
      "openSeason": [
        {
          "from": "07-01",
          "to": "02-28"
        }
      ],
      "protectedAllYear": false,
      "note": "Schonzeit im Wald ab 1.3 (Frischlinge ausserhalb Wald ganzjährig)",
      "id": "wildschwein"
    },
    {
      "name": "Rothirsch",
      "category": "",
      "scientificName": "Cervus elaphus",
      "openSeason": [
        {
          "from": "08-01",
          "to": "01-31"
        }
      ],
      "protectedAllYear": false,
      "note": "Bundesrecht (§ 13 Abs. 1 JV, JSG Art. 5); im Flachland selten",
      "id": "rothirsch"
    },
    {
      "name": "Feldhase",
      "category": "",
      "scientificName": "Lepus europaeus",
      "openSeason": [
        {
          "from": "10-01",
          "to": "12-31"
        }
      ],
      "protectedAllYear": false,
      "note": "Bundesrecht (§ 13 Abs. 1 JV)",
      "id": "feldhase"
    },
    {
      "name": "Fuchs",
      "category": "",
      "scientificName": "Vulpes vulpes",
      "openSeason": [
        {
          "from": "06-16",
          "to": "02-28"
        }
      ],
      "protectedAllYear": false,
      "note": "Bundesrecht (§ 13 Abs. 1 JV)",
      "id": "fuchs"
    },
    {
      "name": "Dachs",
      "category": "",
      "scientificName": "Meles meles",
      "openSeason": [
        {
          "from": "06-16",
          "to": "01-15"
        }
      ],
      "protectedAllYear": false,
      "note": "Bundesrecht (§ 13 Abs. 1 JV)",
      "id": "dachs"
    },
    {
      "name": "Steinmarder",
      "category": "",
      "scientificName": "Martes foina",
      "openSeason": [
        {
          "from": "09-01",
          "to": "02-15"
        }
      ],
      "protectedAllYear": false,
      "note": "Bundesrecht (§ 13 Abs. 1 JV)",
      "id": "steinmarder"
    },
    {
      "name": "Baummarder",
      "category": "",
      "scientificName": "Martes martes",
      "openSeason": [],
      "protectedAllYear": true,
      "note": "Ganzjährig geschont (§ 13 Abs. 2 lit. b JV)",
      "id": "baummarder"
    },
    {
      "name": "Stockente",
      "category": "",
      "scientificName": "Anas platyrhynchos",
      "openSeason": [
        {
          "from": "09-01",
          "to": "01-31"
        }
      ],
      "protectedAllYear": false,
      "note": "Bundesrecht (§ 13 Abs. 1 JV)",
      "id": "stockente"
    },
    {
      "name": "Blässhuhn",
      "category": "",
      "scientificName": "Fulica atra",
      "openSeason": [
        {
          "from": "09-01",
          "to": "01-31"
        }
      ],
      "protectedAllYear": false,
      "note": "Bundesrecht (§ 13 Abs. 1 JV)",
      "id": "blaesshuhn"
    },
    {
      "name": "Ringeltaube",
      "category": "",
      "scientificName": "Columba palumbus",
      "openSeason": [
        {
          "from": "08-01",
          "to": "02-15"
        }
      ],
      "protectedAllYear": false,
      "note": "Bundesrecht (§ 13 Abs. 1 JV)",
      "id": "ringeltaube"
    },
    {
      "name": "Türkentaube",
      "category": "",
      "scientificName": "Streptopelia decaocto",
      "openSeason": [
        {
          "from": "08-01",
          "to": "02-15"
        }
      ],
      "protectedAllYear": false,
      "note": "Bundesrecht (§ 13 Abs. 1 JV)",
      "id": "tuerkentaube"
    },
    {
      "name": "Waldschnepfe",
      "category": "",
      "scientificName": "Scolopax rusticola",
      "openSeason": [],
      "protectedAllYear": true,
      "note": "Ganzjährig geschont (§ 13 Abs. 2 lit. b JV)",
      "id": "waldschnepfe"
    },
    {
      "name": "Rabenkrähe",
      "category": "",
      "scientificName": "Corvus corone",
      "openSeason": [
        {
          "from": "08-01",
          "to": "02-15"
        }
      ],
      "protectedAllYear": false,
      "note": "Bundesrecht (§ 13 Abs. 1 JV; JSV Art. 3bis: Schonzeit 16.02.–31.07.)",
      "id": "rabenkraehe"
    },
    {
      "name": "Elster",
      "category": "",
      "scientificName": "Pica pica",
      "openSeason": [
        {
          "from": "08-01",
          "to": "02-15"
        }
      ],
      "protectedAllYear": false,
      "note": "Bundesrecht (§ 13 Abs. 1 JV)",
      "id": "elster"
    },
    {
      "name": "Eichelhäher",
      "category": "",
      "scientificName": "Garrulus glandarius",
      "openSeason": [
        {
          "from": "08-01",
          "to": "02-15"
        }
      ],
      "protectedAllYear": false,
      "note": "Bundesrecht (§ 13 Abs. 1 JV)",
      "id": "eichelhaeher"
    },
    {
      "name": "Iltis",
      "category": "",
      "scientificName": "Mustela putorius",
      "openSeason": [],
      "protectedAllYear": true,
      "note": "nicht auf eidg. Liste jagdbarer Arten – geschützt",
      "id": "iltis"
    },
    {
      "name": "Hermelin",
      "category": "",
      "scientificName": "Mustela erminea",
      "openSeason": [],
      "protectedAllYear": true,
      "note": "nicht auf eidg. Liste jagdbarer Arten – geschützt",
      "id": "hermelin"
    },
    {
      "name": "Kolkrabe",
      "category": "",
      "scientificName": "Corvus corax",
      "openSeason": [],
      "protectedAllYear": true,
      "note": "Ganzjährig geschont (§ 13 Abs. 2 lit. b JV)",
      "id": "kolkrabe"
    },
    {
      "name": "Haubentaucher",
      "category": "",
      "scientificName": "Podiceps cristatus",
      "openSeason": [],
      "protectedAllYear": true,
      "note": "Ganzjährig geschont (§ 13 Abs. 2 lit. b JV)",
      "id": "haubentaucher"
    }
  ]
}
