{
  "region": {
    "code": "CH-TG",
    "country": "CH",
    "name": "Thurgau",
    "system": "revier"
  },
  "validFrom": "2018-04-01",
  "source": {
    "title": "Kanton Thurgau – Jagdverordnung RB 922.11, § 14 (Fassung in Kraft seit 01.04.2018); eidg. JSG Art. 5 / JSV Art. 3bis; Jagd- und Fischereiverwaltung TG (Jagd- und Schonzeiten)",
    "url": "https://www.rechtsbuch.tg.ch/app/de/texts_of_law/922.11",
    "retrieved": "2026-10-02"
  },
  "confidence": "high",
  "remarks": "Revierjagd (89 Reviere). Kantonal geschützt (RB 922.11 § 14 Abs. 1): von Jungen begleitete Muttertiere (Wildschwein, Reh-, Rot-, Dam-, Sikawild), Gämse, Feldhase, Baummarder, Waldschnepfe, Kolkrabe. Abweichende Schonzeiten Rehwild 1.1–30.4, Rotwild 1.1–31.7 (§ 14 Abs. 3); im Übrigen Bundesrecht (JSG Art. 5, JSV Art. 3bis). Jagdzeit = Komplement der publizierten Schonzeiten. Nachtjagdverbot ausgenommen Wildschwein/Fuchs/Dachs/Marder.",
  "species": [
    {
      "name": "Reh",
      "category": "",
      "scientificName": "Capreolus capreolus",
      "openSeason": [
        {
          "from": "05-01",
          "to": "12-31"
        }
      ],
      "protectedAllYear": false,
      "note": "Schonzeit 1.1–30.4 (RB 922.11 § 14 Abs. 3)",
      "id": "reh"
    },
    {
      "name": "Rothirsch",
      "category": "",
      "scientificName": "Cervus elaphus",
      "openSeason": [
        {
          "from": "08-01",
          "to": "12-31"
        }
      ],
      "protectedAllYear": false,
      "note": "Rot-/Dam-/Sikahirsch Schonzeit 1.1–31.7 (RB 922.11 § 14 Abs. 3)",
      "id": "rothirsch"
    },
    {
      "name": "Wildschwein",
      "category": "",
      "scientificName": "Sus scrofa",
      "openSeason": [
        {
          "from": "07-01",
          "to": "02-28"
        }
      ],
      "protectedAllYear": false,
      "note": "Schonzeit 1.3–30.6; Frischlinge/Überläufer ausserhalb Wald keine Schonzeit",
      "id": "wildschwein"
    },
    {
      "name": "Fuchs",
      "category": "",
      "scientificName": "Vulpes vulpes",
      "openSeason": [
        {
          "from": "06-16",
          "to": "02-28"
        }
      ],
      "protectedAllYear": false,
      "note": "Schonzeit 1.3–15.6",
      "id": "fuchs"
    },
    {
      "name": "Dachs",
      "category": "",
      "scientificName": "Meles meles",
      "openSeason": [
        {
          "from": "06-16",
          "to": "01-15"
        }
      ],
      "protectedAllYear": false,
      "note": "Schonzeit 16.1–15.6",
      "id": "dachs"
    },
    {
      "name": "Steinmarder",
      "category": "",
      "scientificName": "Martes foina",
      "openSeason": [
        {
          "from": "09-01",
          "to": "02-15"
        }
      ],
      "protectedAllYear": false,
      "note": "Schonzeit 16.2–31.8",
      "id": "steinmarder"
    },
    {
      "name": "Baummarder",
      "category": "",
      "scientificName": "Martes martes",
      "openSeason": [],
      "protectedAllYear": true,
      "note": "kantonal geschützt (RB 922.11 § 14 Abs. 1 Ziff. 4)",
      "id": "baummarder"
    },
    {
      "name": "Stockente",
      "category": "",
      "scientificName": "Anas platyrhynchos",
      "openSeason": [
        {
          "from": "09-01",
          "to": "01-31"
        }
      ],
      "protectedAllYear": false,
      "note": "Enten/Blässhuhn/Taucher Schonzeit 1.2–31.8",
      "id": "stockente"
    },
    {
      "name": "Blässhuhn",
      "category": "",
      "scientificName": "Fulica atra",
      "openSeason": [
        {
          "from": "09-01",
          "to": "01-31"
        }
      ],
      "protectedAllYear": false,
      "note": "Schonzeit 1.2–31.8",
      "id": "blaesshuhn"
    },
    {
      "name": "Ringeltaube",
      "category": "",
      "scientificName": "Columba palumbus",
      "openSeason": [
        {
          "from": "08-01",
          "to": "02-15"
        }
      ],
      "protectedAllYear": false,
      "note": "Tauben/Nebelkrähe Schonzeit 16.2–31.7",
      "id": "ringeltaube"
    },
    {
      "name": "Türkentaube",
      "category": "",
      "scientificName": "Streptopelia decaocto",
      "openSeason": [
        {
          "from": "08-01",
          "to": "02-15"
        }
      ],
      "protectedAllYear": false,
      "note": "Schonzeit 16.2–31.7",
      "id": "tuerkentaube"
    },
    {
      "name": "Rabenkrähe",
      "category": "",
      "scientificName": "Corvus corone",
      "openSeason": [
        {
          "from": "08-01",
          "to": "02-15"
        }
      ],
      "protectedAllYear": false,
      "note": "Krähen/Elster/Eichelhäher Schonzeit 16.2–31.7",
      "id": "rabenkraehe"
    },
    {
      "name": "Elster",
      "category": "",
      "scientificName": "Pica pica",
      "openSeason": [
        {
          "from": "08-01",
          "to": "02-15"
        }
      ],
      "protectedAllYear": false,
      "note": "Schonzeit 16.2–31.7",
      "id": "elster"
    },
    {
      "name": "Eichelhäher",
      "category": "",
      "scientificName": "Garrulus glandarius",
      "openSeason": [
        {
          "from": "08-01",
          "to": "02-15"
        }
      ],
      "protectedAllYear": false,
      "note": "Schonzeit 16.2–31.7",
      "id": "eichelhaeher"
    },
    {
      "name": "Feldhase",
      "category": "",
      "scientificName": "Lepus europaeus",
      "openSeason": [],
      "protectedAllYear": true,
      "note": "kantonal geschützt (RB 922.11 § 14 Abs. 1 Ziff. 3)",
      "id": "feldhase"
    },
    {
      "name": "Waldschnepfe",
      "category": "",
      "scientificName": "Scolopax rusticola",
      "openSeason": [],
      "protectedAllYear": true,
      "note": "kantonal geschützt (RB 922.11 § 14 Abs. 1 Ziff. 5)",
      "id": "waldschnepfe"
    },
    {
      "name": "Iltis",
      "category": "",
      "scientificName": "Mustela putorius",
      "openSeason": [],
      "protectedAllYear": true,
      "note": "nicht jagdbar – geschützt",
      "id": "iltis"
    },
    {
      "name": "Hermelin",
      "category": "",
      "scientificName": "Mustela erminea",
      "openSeason": [],
      "protectedAllYear": true,
      "note": "nicht jagdbar – geschützt",
      "id": "hermelin"
    }
  ]
}
